Role of Job,Company Name,Company Location,Type of Work,Description
Energy Management System Specialist,AboitizPower,"Dumaguete, Negros",Hybrid,"Position Summary:This position holder is responsible for the technical and commercial aspect of the Energy Management System including Distributed Control Systems (DCS) and Supervisory Control and Data Acquisition (SCADA) Systems. This includes designing and reviewing Contractor design drawings, developing, supervising the installation of equipment which is used to monitor and control energy storage systems, machinery and processes. He/she will ensure that these systems and processes operate effectively, efficiently, safely and in accordance with the Contract Package.

Minimum QualificationsBS Electronic and Communication EngineerLicensed Electronic and Communication Engineer2 years of relevant industry experience in project execution of power or storage.2 years of Project experience

Competencies:Risk ManagementBudgetingMeeting facilitation

Experience and knowledge on electrical and instrumentation systems,battery energy management systems, process control, system dynamics and control systems. Knowledge of control disciplines such as Advanced Process Control (APC), Distributed Control Systems (DCS), Programmable Logic Controllers (PLC), Human Machine Interface (HMI) and Supervisory Control And Data Acquisition (SCADA) including programming (CITECH, Wonderware, Visual C+, RSLogic, Siemens, Orion Allen Bradley and etc.) and diagnostics, fault identification, troubleshooting, location and resolution.

Ladder diagrams design and development

Proficient with Network Communication Protocols (BACnet, Modbus, Modbus TCP, OPC, LonWorks,TCP/IP, IRIG-B)Proficient with Microsoft application (Operating system (Win 7 or above) , (Win 2003 or above) Office applications (2003 or above), WrikeExperience on report application programming and development (MSSQL, MYSQL, Citect Historian, Report Server etc.)Please note that this is a project-based role initially for 12 months. Extension of employment period is a sole discretion of the company, subject to the individual's approval.


#J-18808-Ljbffr"
Energy Management System Specialist,AboitizPower,"Dumaguete, Negros",Hybrid,"Position Summary:This position holder is responsible for the technical and commercial aspect of the Energy Management System including Distributed Control Systems (DCS) and Supervisory Control and Data Acquisition (SCADA) Systems. This includes designing and reviewing Contractor design drawings, developing, supervising the installation of equipment which is used to monitor and control energy storage systems, machinery and processes. He/she will ensure that these systems and processes operate effectively, efficiently, safely and in accordance with the Contract Package.

Minimum QualificationsBS Electronic and Communication EngineerLicensed Electronic and Communication Engineer2 years of relevant industry experience in project execution of power or storage.2 years of Project experience

Competencies:Risk ManagementBudgetingMeeting facilitation

Experience and knowledge on electrical and instrumentation systems,battery energy management systems, process control, system dynamics and control systems. Knowledge of control disciplines such as Advanced Process Control (APC), Distributed Control Systems (DCS), Programmable Logic Controllers (PLC), Human Machine Interface (HMI) and Supervisory Control And Data Acquisition (SCADA) including programming (CITECH, Wonderware, Visual C+, RSLogic, Siemens, Orion Allen Bradley and etc.) and diagnostics, fault identification, troubleshooting, location and resolution.

Ladder diagrams design and development

Proficient with Network Communication Protocols (BACnet, Modbus, Modbus TCP, OPC, LonWorks,TCP/IP, IRIG-B)Proficient with Microsoft application (Operating system (Win 7 or above) , (Win 2003 or above) Office applications (2003 or above), WrikeExperience on report application programming and development (MSSQL, MYSQL, Citect Historian, Report Server etc.)Please note that this is a project-based role initially for 12 months. Extension of employment period is a sole discretion of the company, subject to the individual's approval.


#J-18808-Ljbffr"
Automation & Digitalization Support Engineer,HRTX,"Tarlac City, Central Luzon",Hybrid,"Position: Automation and Digitalization Support EngineerLocation: North LuzonSalary Range: PHP 150,000 to 200,000/month

Schedule: Monday to Friday, Day Shift Job SummarySupport the design and development of automation and digitalization systems for a fully automated smart factory in North Luzon. This role focuses on evaluating third-party designs, ensuring system integration, and aligning with manufacturing standards. Key Responsibilities Work with design partners on automation system planning and implementation

Review and recommend solutions based on global automation standards

Contribute to system integration and process optimization

Provide technical support during the design and build phases Qualifications Background in automation engineering within manufacturing or industrial sectors

Experience in greenfield or new plant projects

Familiarity with Industry 4.0 and smart factory concepts Relocation SupportOpen to candidates from other regions or returning OFWs will provide one-time relocation package and monthly relocation allowances Benefits Other competitive benefitsHMO with dependent coverage Employment Type: Project-based (2 years) with annual project bonuses"
AI Automation Engineer (Remote),"New Media Services, Pty. Ltd.","Baguio, Cordillera Administrative Region",Hybrid,"About the Role:

We are looking for a skilled AI Automation & Agent Engineer with hands-on experience in workflow automation platforms such as n8n. The role involves designing, developing, and implementing AI-driven automation solutions and intelligent agents for our clients in the Philippines. You will collaborate closely with cross-functional teams to build, customize, and deploy AI agents, automatecomplex workflows, and ensure seamless solution integration that drives measurable client value.

Key Responsibilities:

AI Agent Development: Design, develop, and deploy intelligent agents for various business processes and client-specific use cases.

Workflow Automation: Build, manage, and optimize automation workflows using platforms like n8n to streamline business operations. 

Customization & Integration: Integrate third-party APIs, AI services, and automation tools into client systems.

Technical Research: Continuously explore new AI frameworks, libraries, and workflow automation technologies to drive innovation. Testing & Optimization: Conduct thorough testing, troubleshoot performance issues, and refine automation solutions for maximum efficiency. 

Collaboration: Work closely with product managers, project managers, and client stakeholders to ensure solutions align with business needs.

Qualifications & Skills:

Bachelor’s degree in Computer Science, Engineering, or related field. Proven experience n8n AI development, automation engineering, or software integration projects.

Hands-on experience with workflow automation platforms, especially in (designing and deploying complex workflows)

Strong understanding of AI frameworks (e.g., TensorFlow, PyTorch), APIs, and automation tools

Proficiency in programming languages such as Python, JavaScript, or similar

Experience integrating AI agents with third-party applications and enterprise systems.

Excellent problem-solving skills, attention to detail, and the ability to work independently. Familiarity with cloud environments (AWS, Azure, or GCP) is a plus"
ELECTRICAL & CONTROL ENGINEER,Smartech Le Control Inc.,"Carmona, Calabarzon",Hybrid,"Job Summary:

We are looking for a Electrical Control Engineer who will lead and support automation and electrical control projects. You will be responsible for PLC/SCADA programming, control panel design, system integration, and field commissioning across industrial clients.

Job Responsibilities:

Design and develop electrical control systems and control panel layouts

Program PLCs, HMI, and SCADA systems (e.g., Siemens, Omron, Allen-Bradley)

Conduct field installations, system integration, and troubleshooting

Coordinate with project managers and clients for site implementation

Prepare documentation, project reports, and electrical schematics

Qualifications:

Education:

Bachelor's Degree in Electrical Engineering, Electronics Engineering, or related field

Experience:

At least 2 years experience in electrical controls, PLC/SCADA/HMI programming

Licensed EE/ECE is a plus

Skills/Certifications:

Strong knowledge of control systems, automation, sensors, and drives

Familiar with electrical design software (AutoCAD, EPLAN, etc.)

Can read P&ID, wiring diagrams, and layout plans

With TESDA certification or PRC license is an advantage

Willing to do site work and client coordination"
"PLC Technician - Operations, Sorting Center, SPX Express (Calamba, Laguna)",Shopee,"Calamba City, Calabarzon",Hybrid,"Job description

Installation and Configuration 
Install PLC hardware and software in accordance with specifications and safety standards.
Configure PLC systems for optimal performance and integration with other control systems.

Programming and Development 
Develop and modify PLC programs using programming languages such as Ladder Logic, Function Block Diagram, and Structured Text.
Implement control strategies and troubleshoot programming issues.

Maintenance and Troubleshooting

Regularly performing checks and maintenance to prevent breakdowns.
Conducting inspections to ensure equipment is functioning correctly.
Diagnose and resolve technical issues related to PLC hardware and software.
Perform repairs and replacements as needed to ensure minimal downtime.
Installing new equipment or machinery.

Testing and Calibration 
Test PLC systems and associated equipment to verify proper operation.
Calibrate and adjust PLC settings to maintain accuracy and performance.

Documentation and Reporting 
Maintain detailed records of PLC configurations, programming changes, and maintenance activities.
Prepare and submit reports on system performance, issues, and resolutions.
Keeping records of maintenance activities and repairs.

Safety and Compliance 
Adhere to safety protocols and industry regulations to ensure a safe working environment.
Ensure that all installations and repairs comply with relevant standards and codes.


Training and Support

Provide training and support to other team members and operators on PLC systems and troubleshooting techniques.
Assist with the development of operational procedures and manuals.
Perform maintenance works on mechatronics if needed.


Continuous Improvement 
Participate in continuous improvement initiatives to enhance PLC system performance and efficiency.
Stay updated with advancements in PLC technology and recommend upgrades or changes as necessary.

Requirements

Associate’s degree in Electrical Engineering, Electronics, Automation, or a related field. Bachelor’s degree is a plus.

Minimum 5 years of experience working with PLC systems in an industrial setting.

Proficiency in PLC programming languages (e.g., Ladder Logic, Function Block Diagram, Structured Text).

Strong understanding of electrical systems, schematics, and wiring diagrams.

Excellent problem-solving and analytical skills.

Amenable to work in Calamba Laguna

Ability to work independently and as part of a team."
